Complaint,Premature withdrawal of PPF modified by Finance Ministry not implemented by SBI Branches Plz circulate to branches,END
Complaint,    plz look into the matter   it s already   day passpasses  no response till now   EOM,END
Complaint,   Please  how much do you charge for verve card  Re issue    I think you might have overcharged me,END
Complaint,  Day   na story o  no reversal yet          ,END
Complaint,not working   unknown result  keeps popping up,END
Complaint,then it is illegal,END
Complaint, The information displayed   We are unable to deduct money from your card  sorry for the inconvenience   ,END
Complaint,No i didnt receive an OTP,END
Complaint,I already called the number yet no solution,END
Complaint, Pls i don t know what happen  i tried link my mastercard   paypal    paypal said d card is not accepted What could b d prob,END
Complaint,  Day   na story o  no reversal yet          ,END
Complaint, In this challenging times reversal of failed POS transaction shud nt take   days      ,END
Complaint,i tried changing the pin but there was only one option,END
Complaint,When i visited the link i saw visa card And mine is master card,END
Complaint, Day   na story o  no reversal yet          ,END
Complaint,unable to deduct money from my card why,END
Complaint, Please I m trying to do a transaction online using my card but when i fill in my card details it says unable to deduct,END
Complaint,  G M Av received my Account No on Monday but am yet see the ale for the  k during  AcessBankCSW  Thanks,END
Complaint, hi 
I made a card request over  weeks ago still haven t received I was told it takes only   working days,END
Complaint,abeg wetin I do that you restricted my account o,END
Complaint,please do call now it will go through an app was blocking ur call b,END
Complaint,Sms banking is nt going why  ,END
Complaint,I transferred money from GT to access bank acct since yesterday  I was debited    yet the access acct has not been credited,END
Complaint, so what use are you guys to me  I m closing my account when I get to Nigeria ,END
Complaint,I have tried that number its not going,END
Complaint,Bunch of incompetent people everywhere in this country ,END
Complaint, I made a transaction yesterday from my account   I was however debited without crediting the account I transferred to,END
Complaint,   How could u guys do such to our sister with her   months old child  Indeed it s outdated  It ll affect u guys believe me ,END
Complaint, my numbers are available and moreso  i m always having the issue when i use accessbank app,END
Complaint,Ignoring a customer is wrong ,END
Complaint,Please reply all my messages ,END
Complaint,I tried recharging an airtel line   with    airtime  my account as been debited the line hasn t been credited,END
Complaint, Hi    I tried to buy VTU using the access mobile app  Money was deducted from my acc but the airtime wasn t delivered    ,END
Complaint,I have a scanned copy of my complaints from access bank Maryland branch which was dated on the   ,END
Complaint,I guess Access bank tweeter handles are on Auto reply please prove me wrong by actually solving a customer problem Thanks,END
Complaint,You guys are not looking in to by wrongful debit you guys have just being saying the same thing all over again,END
Complaint, you guys are yet to rectify the problem  it s not funny anymore   it s like you re doing nothing,END
Complaint,I ve done that and the mail was returned undelivered,END
Complaint, 
My mobile banking app was blocked  I can t log into my account and I tried to unlock the device  but I could not ,END
Complaint,it says wrong password or ID but thats what I m using now with my blackberry phone now,END
Complaint, thank you  But considering I already spent $  before the new limits were set  can i still use my card for pos up to $ ,END
Complaint,  cause I m not understanding I have lodged this complaint before and you guys seem not to have sorted it out,END
Complaint,  if you people don t stop calling my line and asking for a random customer I will go and repo you guys to Efcc,END
Complaint,  I have done that  But no response yet,END
Complaint,The paywithcapture app has failed me and their customer service could not do anything for over a week   ,END
Complaint, Hello guys  av u heard about how useless this application called paywithcapture is        ,END
Complaint,   I tried to transfer money using quick teller and I was told issuer or switch inoperative but was still debite,END
Complaint,   I tried to transfer money using quick teller and I was told issuer or switch inoperative but was still debite,END
Complaint,I tried to transfer money using quick teller and I was told issuer or switch inoperative but was still debited,END
Complaint,SuperFrustrated  ContactCenter says Acct is restricted  But we ve getting transaction Debit ale charges  ,END
Complaint,Is there something wrong with your site    can t make transfers,END
Complaint,C,END
Complaint,    The crux of the matter is I want a refund but  I can t seem to ,END
Complaint, DM 
I ve got a complaint ,END
Complaint,why is it not acceptable    but it is boldly written on it that it could be used for legal transactions ,END
Complaint, I was wrongfully debited Via POS since on      I went  Complained at my branch on the     nothin has hpped til nw,END
Complaint, Good morning  I tries withdrawiing with my verve card  Bt it keep telling me transaction not completed,END
Complaint, only   me to get a message that the issue has been resolved when the other bank  is still holding on to my remaining moni,END
Complaint,  Made a complain about deducted money from another Atm twice nd only half was returned,END
Complaint, Na wah for ur customer care u guys are too slow a simple follow back since morning  I nid to DM u and forward my complaint,END
Complaint,I do not want to believe that you are deliberately ignoring my messages  ,END
Complaint,Your internet bank facility is not reliable   ,END
Complaint,im in Uk now my card isnt working  Bvn card you didnt provide so i couldnt do travelex  Access bank useless gan i swear,END
Complaint,but the peter guy in your shomolu branch told me at  am that fx was exhausted for the day  Imagine such utter uselessness,END
Complaint,I also send N  to   via my Gtb on     also not yet received,END
Complaint,  on Oct   by    pm I sent N  was sent to Yakubu dagauda   money not yet    paHOJQI,END
Complaint,I sent  k to a friend yestday  I didn t see  Transfer Successful  but I was debited  D recepient  ve not got d money yet,END
Complaint, Hello  I observed that   has been replying in your stead yet is NOT verified clarifica    nQ,END
Complaint,it s still not working,END
Complaint,Cries in poverty   look at my mate and you can t give me my common $  let me per day   lzcRGaO,END
Complaint, Y all don t reply dms no more     ,END
Complaint,  So   decided to seize my small funds in naira for over a week now  for no exact reasons ,END
Complaint,Y all don t reply dms no more     ,END
Complaint,Free my money now that the Naira is consolidating against the dollar ,END
Complaint, So   decided to seize my small funds in naira for over a week now  for no exact reasons ,END
Complaint,Reply me   don t be acting crazy fam,END
Complaint, its shows that  the service is currently disabled ,END
Complaint,I was unable to register my account   it keep asking for username and password which I haven t created before,END
Complaint, that wat i am saying employee are sleeing they are not resonding to my Complaint,END
Complaint,I have applied   cc  but no response  m u,END
Complaint, I did write and was awaiting a call y day  no one called  My issue is still not resolved as mobile is not registed yet,END
Complaint, No solution yet very bad service,END
Complaint,I haven t received card yet  No one sharing POD   What kind of service is this    ,END
Complaint,I haven t received card yet  No one sharing POD   What kind of service is this    ,END
Complaint,I haven t received card yet  No one sharing POD   What kind of service is this    ,END
Complaint,I haven t received card yet  No one sharing POD   What kind of service is this    ,END
Complaint,I haven t received card yet  No one sharing POD   What kind of service is this    ,END
Complaint,I haven t received card yet  No one sharing POD   What kind of service is this    ,END
Complaint,I haven t received card yet  No one sharing POD  I DM u details,END
Complaint,Your mobile app is not working from law few days   What is the matter          bDGmOn,END
Complaint,Your mobile app is not working from law few days   What is the matter      ,END
Complaint, i hope this works coz have aready submitted twice here and also marked mail to noda officer  seems  employee are sleeping,END
Complaint,  I m still waiting for Card to be deliver frm    Waybill    ,END
Complaint,i have given all docs to your sector   Gurgaon branch to change the address on my credit card account  Still no change,END
Complaint,my case is still unsolved check my all cases for my number,END
Complaint,I can t send the message since the form on the given link says  Please enter valid message ,END
Complaint,firstly ur call centre numbr keeps cutting my calls and now u expect me to fill in my details  ,END
Complaint,already you take too much time,END
Complaint,  Now you guys not sending approved card  Whats wrong with u  Why i have to follow up application with no,END
Complaint, when I try to use my debit card  OTP gets sent to my old number  Please address this soon  It s been almost   months now ,END
Complaint,it s more frustrating when you are expecting money and your banker is delaying it for no reasons   feeling miserable,END
Complaint, shinoyx  com I started the email chain     days back  still unresolved ,END
Complaint,then they Told me the executive would call you for documentation purpose  none of the representatives call me again    ,END
Complaint,i have not got a reference num card num ends with   have a long email chain to share issue faced in accessing mobile app,END
Complaint, wrong amnt    ut staff admitd dt it ws mistake on dre pa as well  evn aftr mailing my issue is the same   /n,END
Complaint, i deposited paymnt fr my credit card via cheque at ur branch     amnt ws clearly mntn in wrds    numeric  yet dey debited  /n,END
Complaint,      AXISMOBILEAPP not working properly very slow working  it s taking too long time for open details,END
Complaint, Highly disappointed with ur service   If ur guys at call cntre dsnt bother   lstn   us    solve our issue  dn y r dy dre  ,END
Complaint,funding a township which is not approved by LDA  Is   also apa of this fraud  ,END
Complaint,      high level of negligence by axis bank branch manager mr arijit das authority must act,END
Complaint,they took  months  provided me only Name card instead of Image card  I have forwarded so many photos  They cheated me  <U  ><U FE F><U FE F>,END
Complaint,your link is not working  whenever i m looking to submit it is not submitting,END
Complaint, my mobile application not working,END
Complaint,I am unable to write any message  The designated box doesn t take the complete message,END
Complaint,  No one has come and resolved it,END
Complaint,it s amazing that your link cannot take my complaint completely  I could just write a few words,END
Complaint, I need suppo email address because phone banking is not able to provide suppo  They say we r forwdng call and hungup,END
Complaint,I am still awaiting for the resolution of my problem,END
Complaint,just wondering you expect me to call to check on the status  and I am suffering loosing time and patience on this,END
Complaint,  Very disappointed with Siliguri Forex Division  Working is worse than government banks  Hope some action is taken,END
Complaint, okay thanks    thing more  i told u to deactivate the sms ale service  bt still u r charging me    yaxes every month,END
Complaint,  worst pa is you guys don t have a call back service and expect customers to follow up,END
Complaint,I have deposited a HSBC Bank cheque on  th oct  Your customer care has no clue and asking me for branch pincode,END
Complaint,     I don t have any account with your bank but I thought the issue was faced by many so lodged a Complaint,END
Complaint,m travelling from tomo  Now tell me how u ll provide me with card   Nw I hav visited branch n given clarification on matter,END
Complaint,      after complaining from the mail id you are asking to complain from registered email or phone number,END
Complaint,Link rd kandivali w branch has made a mistake asking to fill wrong crf form  Now they are asking me fill another CRF form,END
Complaint,  i called your customer service no     time to speak to some and no one bothered to talk to me ,END
Complaint,  now   link rd kandivali w  branch They have not received anything yet  I submitted crf form on  th    was sent on  th ,END
Complaint,  no response then how come the complaint/reference 
The application no is   ,END
Complaint,  phone banking   down since morning  Not good,END
Complaint,i am not receiving card statements   Didn t you understand the issue,END
Complaint,  Promised to disperse the loan in   day but it tuk   days  is it fare Time is very imp  when any  apply for loan,END
Complaint,      madam shikha sharma axisbank must feel ashamed fr negligence of ur branchmanager arijit das,END
Complaint,         sir I don t share  already I shared earlier but no positive response,END
Complaint,dont expect me to call coz i calld dat numbr and no one seems to pick d phne   Its urgent,END
Complaint,    In two days but still no resolution such a bad service from axis bank,END
Complaint,    It has been more than   months since my issue  
Every time I call customer care they say it will be resolved,END
Complaint,       Hi sir it s good to inform you that one of your private sector bank has making fool his customer,END
Complaint,nobody bothered to give an official reference number  this shows the seriousness of your system  that too on cases of fraud,END
Complaint, Your response is hilarious  only if your systems would have any such process  nodel officer responded on oct      ,END
Complaint, wrote a mail to creditcards  com  but still no response  great service one customer lost,END
Complaint,Why cant i reach ur customer care ever      I need to speak  I call them and then the line cuts off   Lyk y      ,END
Complaint,  Worst mistake bgt Neo CC in Aug    stl nt able to manage card via netbanking r mobile app Cust service is clueless,END
Complaint,The slowest Indian Bank server    AxisBank but the fastest in timing out while logging in   th attempt to l  ,END
Complaint,  Not receiving credit card statements for months  Complained many times  but no action ,END
Complaint, Still no mail for October       Funny customer service  clueless customer care  not answering branch and invisible mail,END
Complaint, 
I cant proceed for online transaction with axis debit card
Its shows the following   UJ,END
Complaint,I can t make online transactions even though my mobile number is registered    B,END
Complaint,  Shockingly in a few days I received an add on card in my wife s name  But now people are torturing me to get add on card,END
Complaint,  Have told them many times that I am not interested still people are calling me very frequently,END
Complaint, What actually takes couple of min to solve  you guys have been dragging for   full working day  SHOWS up your attitude  ,END
Complaint, There is no mail with service request number   dated October      which was sent to me,END
Complaint,Why are your customer care executives are sending irrelevant mails to me without understanding the issue,END
Complaint,  The front desk representative  Dum Dum  mis behaved with me why bad treatment to customer  Very upset with this,END
Complaint,what is meant by suppo if u cant call me,END
Complaint,  Team I will get same checked 
But no calls in last   days pathetic experience ,END
Complaint,had sent mail but not received any reference number,END
Complaint,Who gave you the right to deduct balance without customer s concern,END
Complaint,is der anyway u can help or u r as worst as ur cust care and branch ppl w no value for customer s time  Always misguiding,END
Complaint,your customer care has misguided me every time  To a surprise dey can send me statement on my resi address but not card,END
Complaint,not received any reference number but ya ur customer care has history of my conversation with dem,END
Complaint,        manager and deputy manager ignoring calls and not solving issues,END
Complaint,making fool from   months  debited money from savings account without informing and without reason and no accountability,END
Complaint,   worst ever customer service from icici bank Nampally  Hyderabad branch ,END
Complaint,   seems like no one is bothered and ready to help me  i need to now approach consumer court  wait n watch,END
Complaint,  ur bank atm still out of service  no money  people using HDFC with good service,END
Complaint, your illiteracy about India    its ppl continues   Not sure how it makes sense   u when u air Hindi ads in Kannad,END
Complaint,   Its being over a year    I haven t received any reply on my issue 
Seems u ppl are deaf enuf ,END
Complaint,     still cheque is not cleared  slowbank ,END
Complaint,  still cheque is not cleared  slowbank ,END
Complaint,Have booked one ticket from BPL to NZM and then cancelled  But the refund hasn t received as yet      gCgvYg,END
Complaint, I got a mail from a branch  i replied but no reve from their end  Manager s no  mentioned therein was also wrong ,END
Complaint,  How do you expect your customers to call you if you don t provide any contact informatio    TQc w,END
Complaint,   I had to make rounds to the bank  multiple calls  it s scary how they really don t care,END
Complaint,Surprising  Recall a dodgy forex txn on my credit card and they immediately blocked the card    sent a new one  ,END
Complaint,had complained to   about suspicious activity and they never really did anything about it,END
Complaint,  I ve applied HL in Virar branch but even after   month I ve received not received the Sanction letter,END
Complaint, over   days now  where is the cashback  have not received anything so far on my   savings account,END
Complaint,So you don t even care to respond to tweets as well   eh  nice way of providing suppo,END
Complaint,what s use of intrnl debit card when it doesn t work I tried using platinum debit card in Uae    it doesn t work I m stuck,END
Complaint, Hey    a transaction on   xyRaQ was cancelled and refund hasn t been reflected in my account yet ,END
Complaint,Call Needs to be From Mr  Ravi Narayanan as Promised Earlier  Query Ref No  ICICICARE=      Only Got  TarikhPeTarikh,END
Complaint,  not need to do anything for me  I will manage things  I don t want to use your atm services from now on,END
Complaint,Change this to ICICIBankNeverCares,END
Complaint, leave it man  close that account   I am opening a AC in axis bank,END
Complaint,  they never answer on your issues  But just to manage Twitter,END
Complaint,   what the ATM isn t fixed   Badi Badi baatin vada Pav khaate  

     ,END
Complaint, Any Reason Why   is Giving   Tarikh Pe Tarikh   from   Weeks    Ref No       
 TarikhPeTarikh  ICICI  ICICIBank,END
Complaint,     u ppl are ridiculous Can t even reply to one tweet while u keep calling and irritating for cred,END
Complaint,Money deposited in ATM is not reflected in my account  And no one is answering   waiting,END
Complaint,Shared my contact number on DM but haven t received any call,END
Complaint,  I want to address a bad experience I have gone through with your bank Housing Loan department,END
Complaint,           
ICICI bank cheating with their customers ,END
Complaint,           
ICICI asked my no  To hear my concern  however no call recd,END
Complaint,     
bank should have told to wait for a week  This option was given by ur executive ,END
Complaint,     
ICICI reduced rate for all on Oct   to      so why was this  k charged to me ,END
Complaint,     
   RBI reduced rate by   bps  however icici reduced only   bps   ,END
Complaint,      what is going on in reputated banks like icici how can we trust how they are neglecting,END
Complaint,        it s wealth account    frm last  weeks no communication 
Don t know wat is going on with such reputed bnk,END
Complaint, been comm via email for   mnths  no help sadly had to escalate to my bank to refute charges   case      ,END
Complaint,funding a township which is not approved by LDA  Is   also apa of this fraud   ,END
Complaint,  u ppl are ridiculous Can t even reply to one tweet while u keep calling and irritating for credit card ,END
Complaint,funding a township which is not approved by LDA  Is   also apa of this fraud     SCusd,END
Complaint,funding a township which is not approved by LDA  Is   also apa of this fraud     APP,END
Complaint,we have had a very embarrassing episode of an international transaction  I d like to DM you the details ,END
Complaint,   Read about   Step verification is mandatory by RBI only  not for the Foreign payment processors ,END
Complaint,your courier partner  xpreesbees is horrible not replying mail and not delivering product even if they had for last   days,END
Complaint, Several attempts failed to get my money back under SR    do ICICI bank authorities really c    Q fBNEOE,END
Complaint, My card PIN  First Flight doc P Q  not yet delivered  Lying at Bhopal since     No proper reply given by courier ,END
Complaint,Icici bank doesn t cares  Had given complete documents to open current account but CHD sec   branch is not responding  ,END
Complaint,that s nt d point card was blocked for no reason  Saying dr  case of fraud  While serving no purpose  What sorcery is this,END
Complaint,Also this is not about you calling me but selling me something based on lies    deceptions,END
Complaint,when I can expect call  Its more than   hours,END
Complaint,   hey fraudsters  yes u  r u gonna do something about the burglary u did on my acc  Cant believe u cant respond too,END
Complaint,i am shocked he was use very unprofessional behavior    threat me ,END
Complaint,     thy r least interested in problems facing by their customer in daytoday life  poorcustomerservi,END
Complaint, withdrw amt  f  Rs frm Atm  CanaraBank Durgapura jaipur got only   frm Atm        ,END
Complaint, 
U asked me to share d no  I have shared  however no call has been received  ,END
Complaint,not resolved till now    Really not happening ,END
Complaint,this is what you get   Now  Why can you not provide statements on app  phone banking   email   B  ,END
Complaint,    need to shift home loan and hence need all this man   What a bank  in this age of online banking  ,END
Complaint,  thy r least interested in problems facing by their customer in daytoday life     nj,END
Complaint,Icici card blocked for no reasn  Exec has no answr  sugsts I got new card         notoicici  sadservice,END
Complaint,        Close this DEAD ATM  POOR SERVICE FROM PAST  MONTHS  NO AC  NO MONEY  NO REC ,END
Complaint,   I need money right at my doorstep  This is  th to  th incident I m reporting  I can t hear/read the wor,END
Complaint,        Close this DEAD ATM  POOR SERVICE FROM PAST  MONTHS  NO AC  NO MONEY  NO REC ,END
Complaint,  If you guys are so efficient with sending me bills  Show some efficiency when I need service,END
Complaint,  My online payments are stalled because of zero cooperation from your side,END
Complaint,  The Customer Care Executive said that it will be done within   working days  Its been more than a week,END
Complaint,  Is giving me a tough time  HOW THE HELL DO I CHANGE THE REGISTERED MOBILE NUMBER ON MY CREDIT CARD,END
Complaint,get the address from icici Facebook team  I have shared my details for last all events  I can t share it again and again,END
Complaint, Welcome to   if you want your own home loan a/c stmt  pls visit branch  Worst banking experience ever ,END
Complaint, 
Nd I have received msg that refund amt is credited in my account than why r u adding that EMI amount in statement,END
Complaint, 
But now system is saying that there is   something is still pending of EMI   What is this ,END
Complaint,There is no reply already   business hours gone CEO N EMPLOYEE ALL ARE SHAMELESS       ,END
Complaint,   lame  worst  fraudsters  thieves I am still waiting to hear from u thieves  U stole my money   shameless,END
Complaint,I need money right at my doorstep  This is  th to  th incident I m reporting  I can t hear/read the word sorry,END
Complaint,having the worst experience from past couple of month  Least bothered,END
Complaint,     Close this DEAD ATM  POOR SERVICE FROM PAST  MONTHS  NO AC  NO MONEY  NO    lrrSDXiH,END
Complaint,shut this official page then if you guys cannot repond to cuatomers compalint,END
Complaint,    Amazing Service by ICICI 

  mnNEXZ

      never let that happen ,END
Complaint,Same till date  No call yet  Pathetic,END
Complaint,why is credit card not updated in cibil for my card   ,END
Complaint,    Great thought Chanda ma am  Better tell someone to cleanup ICICI suppo as well  It s USELESS,END
Complaint,same way a chat suppo which tells me to call customer care number is useless,END
Complaint,On top of that I cant get a simple OTP on my phone so my account is practically useless for me  I guess better close my a/c,END
Complaint,The person on chat can not create a suppo case either  Why have such channels which are no help,END
Complaint,And the phone lines are always busy  What the hell is going on,END
Complaint,Guys why do you have chat facility for NRI customers if they cant provide any suppo and tell to call customer care number,END
Complaint,    Still waiting for call  In dis era i had to visit branch    yet issue is unresolved,END
