Complaint, Dear   you have the worst Customer Care  Also the staff at your branch is not helpful,END
Complaint,you guys last called me on  st October saying someone from bank accounts team will call me    days later nothing,END
Complaint,there has been a wrong debit and no one seems to care,END
Complaint,there is an issue with my credit card statement    the branch said they can t help  Cust care exec put me on hold for  mins,END
Complaint, Dear   you have the worst Customer Care  Also the staff at your branch is not helpful,END
Complaint,Dear   you have the worst Customer Care  Also the staff at your branch is not helpful,END
Complaint,very disappointed with ur credit card and customer care service worst service have ever seen from any bank,END
Complaint,STILL NO RESOLUTION TO MY PROBLEM    DAYS TILL NOW  REALLY BAD,END
Complaint, just received a call  disgusting  not customer friendly  wanted me to receive the cheque books  km away  Will stop acc,END
Complaint, for gave no     called up person said its wrong no such utter mismanagement  check your DM for details    ,END
Complaint, cheque dropped on  th Oct at JB nagar Bangalore not cleared yet  call center said cheque not yet gone for clearance     ,END
Complaint,  just got a phishing call for my ICICI bank credit card from number     Talking about refund of  k due to me,END
Complaint,  It hasn t come to FreeCharge account and neither returned to Bank account,END
Complaint,   trying to call your CCnumber since yesterday  it is impossible to talktoyour CC officer my email id mehrashish  com,END
Complaint,my communication address as per bank record  Don t understand why blueda does this everytime   BJ wgQw,END
Complaint,still no calls from any body and this is what I see in blueda site  Why should I mention my dept    dMiRq,END
Complaint,  have issues with my credit card bill  Was promised call back within   hours   days back by customer care
Still waiting   ,END
Complaint,do you realise that it s been over   hours since I gave my number  What kind of pathetic customer service is this,END
Complaint, i have sent my number  but nothing happened ,END
Complaint,       giving vague and evasive answers to wriggle out of their responsibilities  p,END
Complaint, I hv using ur CC from   i want close and i spk with ur CC Executive on Oct  th  th   th but it was not satisfied,END
Complaint, Thanks  after much disappointment now we are in the process of changing our Primary bank  Changing status took   months ,END
Complaint,got my ATM card after   extra days ,END
Complaint,says it should be sorted with make my trip and does not respond to my messages,END
Complaint,I booked air ticket on   through credit card from      Payment id not go through,END
Complaint,   Block chain or blocked operations    feeling disappointed not getting last disbursement ,END
Complaint,am in the same boat  Apps    the block chain  seems meaningless if a simple disbursement takes so lo  ,END
Complaint,Really  Serious  We had to give multiple copies of all documents and sign ten forms to change our resident status  GoGreen ,END
Complaint,As per Customer care exe   Imran Ahemad  OTP /Grid value ask for first time user  Great way to loose money   ,END
Complaint,Do you want to get bankrupt Open  account in ICIC bank Debit card not asking for OTP /Grid Value    ,END
Complaint,please don t commit if u can perform    days passed since I DM my details   u no one called  Shame,END
Complaint,  Your Chat helpline is complete waste of time  Whatever u  ask asked to contact custmore care  y waste time  ,END
Complaint,Banking with ICICI since it s inception Relationship Manager System is a farce as he does nt resp /is of no help at all ,END
Complaint,Bank numbers of Branches are wrong if correct are not responded to by the Reward of being a Wealth Management Customer ,END
Complaint, is becoming a pain   bank with lacdaisical attitude    indifferent attitude has made the bank much worse than PSU  ,END
Complaint, As a privileged customer of ICICI  this is the worst service I have ever received   icici  ,END
Complaint,     Shame on you    Chasing for a loan disbursement for   days    getting lame excuses  Anyone alive here ,END
Complaint,   don t open your account with them a sincere advice might end breaking your own head and cursing self  pathetic,END
Complaint,still waiting   worstcustomerservice  EpicFail  banICICIBank  banking  ombudsman   ,END
Complaint, ICICICard cons on BLUE DA    NOT delivered  shown  premises locked  despite giving house location BHOPAL,END
Complaint,that make me force to open my SSA in SBI Sandipani Branch Porbandar  May b soon will shift my salary account as well,END
Complaint,        icici bank porbandar refused   open SSA unless i open saving ac for gl child,END
Complaint,  Rem n   SR  Nobody frm bank has responded regarding the open issue  Wondering if anyone is even looking into it,END
Complaint,How long does it take to get a Credit Card Issued   Its s taken me a month and i haven t gotten mine yet  Pathetic Service,END
Complaint,link not working,END
Complaint,do needful urgently as it s my first experience with icici and it s getting worst  ,END
Complaint, i had a issue with wrong IMPS transfer I decided QUIT ICICI Miss Sita made me to feel great    made me to stay back Thank u,END
Complaint,  can t  makeiteasy  badexperience  likegovernment  badolddays  diaconnected from customer,END
Complaint, credit card application pending since last   month   Bhai ye he apki services approved twice also also not getting a card,END
Complaint,I made a payment for purchasing ticket on   website  The payment is deducted from my account but is not received  /n,END
Complaint,Dear   I haven t applied for credit card still M receiving mails frm you asking me to verify my application which I never done,END
Complaint,     I just want to know wht u r doing alway ans same I want result wht time will take to slove this,END
Complaint,     by this repo of bank is spoiling clear this issue as soon as its very serious n authntc issue,END
Complaint, same thing you are repeating frm last  days,END
Complaint,after   days of wait      calls   finally i have to reso twitter  you debit me thrice for a transaction and no credit yet,END
Complaint,   its been more than  hr still waiting for your so called   concern team   to reach me  ,END
Complaint, Still Waiting     ,END
Complaint,     After   days of failed transaction amount is not getting reflected to my account    is my account no ,END
Complaint,  overcharging EMI and not adjusting pa payments despite   months of follow up SR  horrible service,END
Complaint,  cabinet has already approved no surcharge on online transactions what u are waiting for    c iVU,END
Complaint,I am already maintaining min bal of  K with u at     Are u still hungry to earn from me by way rail bookings,END
Complaint,Getting standard and helpless response from customer care  Huge Money got debited but not credited to merchant  Help fast,END
Complaint,  days   ATMs none wrkng  Sadar    Ganga Nagar  Why error msg in Marathi I cnot undrstnd whts written  ,END
Complaint,it shows ur negligence   The same dialogue earlier also but no call  Playing with people money,END
Complaint,   Already called customer care today  they told me it will be credited by EOD  Still not yet credit    HURpXo,END
Complaint,  DP charges got deducted from my account without any notification on my mail   NotHappyWithICICIServices,END
Complaint,Dear   such kind of response is not expected in a professional site i guess          co ebGBjXgJy,END
Complaint,your link for sending private messages does not work   AzPXCiv,END
Complaint,I am already in touch with ICICI officials  Its very sad that you made APY compuslory for account opening ,END
Complaint,      No account opening in ICICI without subsription of APY  Application ID ,END
Complaint,Pathetic customer care   dont rely on ,END
Complaint, ATM security is bank responsibility  How can any bank get away and blame customer for ATM fraud for their hard earn money,END
Complaint, I urge MS Chanda Kochar to intervene  ICICI official are not customer frandly,END
Complaint, I suspect that  without involvement of Bank official  ATM fraud can not happen  Its full racket going ,END
Complaint,another stupid mail no solution provided  still credit card due amount is aprearing on bill payment    QDVhgkqv,END
Complaint, sent an email to u   days ago  no response  applied for cheque book wanna deliver at office address,END
Complaint,  Ur Internet Banking is so pathetic  I never had issues with     or ,END
Complaint, getting coral debit card replaced for the  rd time in past year and a half  Stops working during urgency  very inconvenient ,END
Complaint,u guys messaged me that you ll get in touch  Still hvn t received any calls  Need to resolve a credit card transaction issue,END
Complaint,  Let down by the abrupt hanging up of calls with customer care executives   disappointed,END
Complaint,  saying statement not given to d gupta jsaw proved u all r bastards,END
Complaint,poor customer service,END
Complaint,   Why no option for   Disbursement Request   on iLoan app   ,END
Complaint,   if you don t do anything about it in  hours  im shifting to  ,END
Complaint,  fraudulent activity on my account  icici Chat team says they can t do anything about it  Kudos  Great service,END
Complaint,  fraudulent activity on my account  You guys don t even care to reply to the email,END
Complaint, just got a call frm ur telemarketer  I told her I don t hav credit card  n indeed I just hav debit card  She called me Liar,END
Complaint,I wanted a cc  Hv a decent itr last year but was refused w/o even looking in  the matter by d person referd by Swaroop nag,END
Complaint, Disappointed   several emails  calls and tweets  No response  no care for customers  Planning to close accounts ,END
Complaint,  Have courtesy to reply to emails  I have been your customer for over   years,END
Complaint,  You have no value for customers  Pathetic service,END
Complaint,it was a curtesy call from the team  A non committed response on the resolution of the prob  WIP status ,END
Complaint,    I haven t received the kit or details yet   th Oct was deadline    S,END
Complaint, unauthorized  illegal charge on my bank account by ICICI 
Reve back the money or i will be forced to take legal action,END
Complaint, still machine not Working complaints made   days ago still not resolved
  India s largest    WMtnWFNe,END
Complaint,I received credit card  not active which was valid from F  in feb      you charged me    to avoid CIBIL faulter repay me,END
Complaint,   My updated debit card did not receive  blue da AWB   and you have blocked my regular card ICICI useless,END
Complaint,pathetic services here in  kanpur  Never seem to improve   services whatsoever prvilige banking a sham,END
Complaint,Dear   your ATM id S CW  has major problem and it does not work wasted my   minutes you can t pen    TzX mh,END
Complaint,Why your offcials are always out of their mind and dont rread the mail carefully  I feel like completelly pissed off  ,END
Complaint,In Aug I booked bus ticket through   using   debit card  As said I am supposed to get   rs Still I have not  ,END
Complaint,    swachata abhiyan would be such a fun after harassing the customers  Isn t it  ,END
Complaint,    R u not serious abt bug in banking app imobile Dirty crime promised   return my money but no use,END
Complaint,appno    onemonth goneby n partial pickup of document has been done No wonder u r loosin mindshare n marketshare,END
Complaint, When   says  we will call you  it certainly means at least after a day  Even if it is fucking urgent ,END
Complaint,Each time I try to log in I have problems  Now my account number is not recognised and the only phone numbers are in India ,END
Complaint,wer the hell is ur response  U debited  rs towards card which is not issued to me ,END
Complaint,How many Cr cards been issued  who has authorised  auto debit frm my AC This is indication of    yexCDjf,END
Complaint,   He did not address my concern  See    j cj  the bank is not allowed to automatically tak,END
Complaint,DM not working,END
Complaint, Online transactions not going to opposite party  no satisfactory response from your team ,END
Complaint,Only occured when trying to load   wallet attached with    Was able to use the grid on other apps for payment,END
Complaint,Not getting the grid card while adding money to the wallet via   Netbanking    Un  ,END
Complaint,Pathetic customer care service by  ICICIbank     all of a sudden debit card showing blocked  help,END
Complaint,  several reasons incapable ppl mistreat u misbehave never solve problem  Dont understand basucs u r penalized,END
Complaint,    rubbish,END
Complaint,    fake cleanliness campaign  This bank enjoy harassing customers,END
Complaint,do whatever u want I just don t need any more calls I need execution of the commitment  I am not repeating again    again  ,END
Complaint,    the day this bank closes will be swachata in society,END
Complaint,    since morning I have nothing to withdraw why should this bank which harasses close down,END
Complaint,    when I asked to refund what deducted wrong by them this bank blocked my atm card  intelligent,END
Complaint,    this is the worst bank I have seen  Customer care harass u to the point of suicide,END
Complaint,  worst bank on this earth,END
Complaint,  worst bank  They should close down,END
Complaint,  worst bank ever  They harass you and make a mess of ur life  Stay away if u can,END
Complaint,  worst bank enjoy harassing u   Have made simple situatuion a hell  Why dont u guys close down,END
Complaint,  worst bank who enjoy harassing u,END
Complaint,since morning I m trying but no help  Have DM as well but as usual no solution  U should close this bank if cant handle,END
Complaint, no need  I am on my own  It was nice working with  icicibank I have to say goodbye to your service
 ClosingMyAccount,END
Complaint,  times i have contacted from the last   month but got no response,END
Complaint, No action yet on my cashback issue of  IciciPockets,END
Complaint,but without my approval why my account info updated frequently   ,END
Complaint,without customer knowledge every now and then updating details  Recently remove my mobile number  m my ac feel unprotected,END
Complaint,It is over   days there is just one communication from your team but no action   failed to help   yr old customer,END
Complaint,    over two hours and I have not got a single resposne  So much for service,END
Complaint, getting the pin code change sms everyday for   week  I have done  still receiving the same SMS everyday  whats going on ,END
Complaint,  just shut the fuck up   How many times do i need to change the pw   U guys send me messa  ,END
Complaint, icici bank blocked my debit card when I asked to refund they wrongly deducted from a/c  Will inform world if not solved now,END
Complaint,my iMobile app stopped working   Tried everything your ppl told  Still no success,END
Complaint,   It s   unauthorised atm withdrawal transactions  Waiting for the reve  ,END
Complaint,what do u want customer should die else u won t stop harassing  Not once not twice every time u guys harass and I ll treat,END
Complaint,what do u guys think we have an account here so u would behave like as u feel  Harass me for your comfo,END
Complaint,third class useless pathetic experience  Customer care harass u to full   Fault is that I hv an account in this hell,END
Complaint,Electronic branch at a prime western suburb with   ATM machines yet NOT a single one working  How do you do this   ,END
Complaint, Cash Deposit Machine always not working   kamala mill Compound Lower parel 
Useless service from largest pvt  Bank of India,END
Complaint, is this hw u keep curncy notes in ur ATM  Frustrating  I think a bank like ICICI should nvr do it    ndF,END
Complaint,requested debit card on  rd oct still waiting     becoming  besharambank   days and counting stolencardreplacement,END
Complaint, 
Just interact with sayed at and he is telling me that the normal debit card easily hacked compare of coral debit m shocked,END
Complaint,solution and it is irritating ,END
Complaint,To make   DD we need to fill   DD slip n ur DD charges r  rs per DD   So how do u benefit the cust  indianbanking  rbi,END
Complaint,Chor bank still didnt able to find anything   ,END
Complaint,u have taken much time I feel from August,END
Complaint,No use  You promised on Facebook also  Only Mr Kotak  can solve or I suicide,END
Complaint,    could you plz tell how many time i ll put requst of my name change error which is done by u  times resqtd,END
Complaint,   is freaking me by draining all my money  No help till now,END
Complaint, Congrats   for new record
No response to my SR in more than   months,END
Complaint,how long     It s more than a month since I raised this complaint,END
Complaint,our issue has not been resolved their are charges levied tune to rs   and they are reversing only rs   are we beggars,END
Complaint,let down my expectations  Response is disappointing and inefficient paper work    I expect swift action on this,END
Complaint,  looping you     this guys have recovered money in a very unethical manner,END
Complaint,very disappointed few deposits not shown,END
Complaint,my kotak netbanking not showing updated statement details,END
Complaint,it s been   days since I first raised the issue both over call and email  You still don t have answers,END
Complaint,       If your ch   pa over take an action agnst ur bnk else u r a Chor tat I alrdy prvd so mny,END
Complaint,   if ur Bnk have little shame then ur representative can call me now        ,END
Complaint,I HAVE NO DEBIT CARD OTHER WISE BANK CUT THE CHARGES FOR DEBIT CARD AND NOT REFUND WHT CAN I DO,END
Complaint,   
Dear Sir
Dear Kotak team
There is no reply on my tweet dt  th Oct   pm  Clear case of misselling Insurance/Inv ,END
Complaint, ref to my pending issue  KMB customer care says branch wd help and branch says customr care   what s this ,END
Complaint, I have a one time closure letter dated     for my loan account  after lot of follow up it is not closed ,END
Complaint,Team request closed  Without even informing about the outcome  Wat happened with my money,END
Complaint, Someone is misusing my email ID on an ICICI bank account  how can this be stopped,END
Complaint,what haapen guys again rs   was deduted from my account without any information should i highlight this issue with Uday kota,END
Complaint,it s not funny to circulate invalid phone nos  to customers   just saying    e Csfo,END
Complaint,this toll free no  is invalid    Iid,END
Complaint,    Kotak bank  Chor Bank   it seems like it s your dhanda to deduct amount ftom account    ,END
Complaint,unable to use netbanking service to transfer funds within kotak accounts   complaining for the  rd time still unresolved,END
Complaint,  disappointed with ur atm services   just lost  bucks for three transactions   Txn        and     happend twice,END
Complaint,since morning your customer care number s busy and im unable to reach KMB to seek an update on my pending problem,END
Complaint,  I thought grievance redressal is slow only for me  ohh it s same for everyone  badservice  waitingfrommonths,END
Complaint,u have been saying this for month now  Is there really any conversation between u and ur relevant team ,END
Complaint,     rajourigarden  branch   Newdelhi  worst  service troubling my sis after encashing the cheques,END
Complaint,       rajourigarden  branch   Newdelhi  worst  service so much trouble to open my    my kids a/c
Disappointed,END
Complaint,        rajourigarden  branch   Newdelhi  worst  service cheques encashed but no detail of my accounts,END
Complaint,        rajourigarden  branch   Newdelhi  worst  service so much trouble to open my sis    kids account,END
Complaint,  if customer stops complaining then ur team even forgets that there was a complaint  badservice  unhappycustomer,END
Complaint,  it s almost a month now   have u found ur relevant team  this is really bad customer service  wakeup  kotak,END
Complaint,  udaykotak 
What do you expect patience from other person what about your responsibilities pathetic and Lathargic services,END
Complaint,  udaykotak 
Get my issue resolved before this weekend  otherwise I will paste screenshots of entire mails on social media,END
Complaint,Now After all this Issues  I am getting a notification of Amount      Due as penalties    Common Team   PoorKotakbank,END
Complaint,Chor bnk will  u call/reply       ,END
Complaint,tired of your promises,END
Complaint, Please close down your alwarpet branch in Chennai as it is useless and you have robbed me of Rs    ,END
Complaint,Y the hell amount gets deducted from credit card without notification ,END
Complaint, Chor bank u can learn some banking from               uUBpwEYG,END
Complaint,    If your ch   pa over take an action agnst ur bnk else u r a Chor tat I alrdy prvd so    J WZ,END
Complaint,   everytime pls give me your DM what action you r taking  will you ever take action against   ,END
Complaint,    Chor bank Kotak is a chor bank            td G,END
Complaint, Kotak bank  Chor Bank   it seems like it s your dhanda to deduct amount ftom account    ,END
Complaint, Its pathatik  kotak bank is blackmailing customer to reverse false charges  if we buy life insurance       BS qUZ,END
Complaint,Wht abt my other charges  They have committed to do needful within   days   Its already   days now       Q mVs m,END
Complaint,your service and customer suppo is poor and pathetic,END
Complaint,kindly reverse the said charges immediately otherwise I will not think twice moving to banking ombudsman for the same,END
Complaint,any reason behind it and I think so that you haven t reversed my charges of rs   levied by due to your wrong doing,END
Complaint,so that I can check my card statement for reversal of overnight fees levied by you for decreasing the card limit without any,END
Complaint,you are still the worst bank you have send an sms regarding the card dues but not the card statement on mail so that I can,END
Complaint,every time instead f a resolution i m getin a foreclosure letter,END
Complaint, u dnt wanna resolve my problem  dnt want to talk to me  u rnt respondin for ages    U NLY WANT ME TO EXIT YOUR BANK,END
Complaint,i dnt think KMB is in any mood to help me  I want to knw what can yr bank do to rectify my CIBIL whc u guys have spoiled,END
Complaint,I MUST TELL U THAT EVEN AFTER  MONTHS NOT A SINGLE PERSON HAS EVER CALLED ME FROM YR BANK W R T  THIS ISSUE,END
Complaint,  days gone   and over that   months eaten away  What is your bank doing  Reply saying u cnt do nythin  U r wastin my time,END
Complaint, hi   I havent received any call until now   Can you be serious about these issues or else I all be more serious then ,END
Complaint,i converted for emi on credit card but showing full amount due emi conversation was successful my no ,END
Complaint,   And ad says kona kona kotak when cant resolve a minor issue   Imagine the reputation loss on one side,END
Complaint,  neft done   days bck still nt cr to beneficiary Callcentre unable   help useless unprofessinal guys rnning d show,END
Complaint, already raised a consumer complaint against your bank 

 kotak

You can congratulate your executive for this ,END
Complaint, It s been more then a month but this bank don t care 
Would suggest everyone to close their relations    xbb,END
Complaint, It s been more then a month but this bank don t care 
Would suggest everyone to close their relationship with this bank shame,END
Complaint,doesn t care if the customer is suffering bcoz of careless attitude  shame on you being a bank      wvmIgLy,END
Complaint,Poorva sending mail and required documents for the last   days,END
Complaint,and you guys keep failing at it poor excuse for a bank,END
Complaint,my complaint has not been resolved  and yet I am getting a mail today saying my complaint has been closed how,END
Complaint,you ppl are not replying to my mails from     weeks this is how you treat your cstmrs I dnt believ u hv dat big user base yet,END
Complaint,IT DOES NOT PERTAIN TO KOTAK MAHINDRA BANK  It is for Kotak Securities  Read the tweet man,END
Complaint,that is correct but the issue is yet to be resolved,END
Complaint, Customer Service Sucks at Kotak Life Insurance and conveniently does not have a
Twitter handle also     Kotaklife  ,END
Complaint, just one reply needed  WHY AFTER   MONTHS  IS IT MENTIONED in your charges table WHY MANUALLY DEDUCTING CHARGES ,END
Complaint,I know i am fighting against a wall who will just not agree to their misconduct  will surely keep this fight on in other forum,END
Complaint,the dangerous point in any deal is   STAR  n ur sheet is full of it  which means u intend to cheat people if they do nt notice,END
Complaint,why take after   months is my concern  THAT AMOUNTS TO CHEATING is my point    EVEN AFTER A MONTH is dubious,END
Complaint,all other banks i deal with take charges immediately which is best  You know ur charges before taking the service,END
Complaint, every bank takes a charge and i am fine with it  but you need to tell not take it discreetly  Thats my point  Why the time lag,END
Complaint,your sheet has so many   Stars  which itself shows the intention of cheating If u want to charge then write the figure why a ,END
Complaint, Chetting the customer and not replying,END
Complaint,whytake charges after   months Why so secretly Why is there no fixed date   charges to be deducted why take twice demat chrgs,END
Complaint,Thats my point  Why no clarity  Why a   Star   Ink gets wasted to write the charges  What do u mean by applicable charges,END
Complaint,I am being charged twice in a month for demat account   WOW   this proves that cheating nature  The heights of downfall,END
