Complaint,never get any reply via emails either,END
Complaint, on top of that  cannot connect to customer care  typical kotak service,END
Complaint, wtf kotak  charged my account repetedly four times and didn t care to tell me what for  what kind of service is this ,END
Complaint, have received an SMS from   on  th oct  till now I haven t received my parcel  No response on call   ,END
Complaint, Ive aready had to change   privilege mgr  but looks like the problem is organsational  would never happen with a HDFC for eg ,END
Complaint,it has been more than   months i am tired of complaining agn n agn can you let me know the estimated time   may b nxt yr,END
Complaint, If something is getting delayed  do us the courtesy to say so  Everyone is on leave  and those who arent r in   meetings  ,END
Complaint, again  extremely disappointed  your privilege customer mgrs do not keep commitments  stop answering calls  refuse to ack sms ,END
Complaint,you are the worst bank,END
Complaint, High time theses companies should sta taking consumer distress as important     fraud  KotakMahindraBank ht,END
Complaint, Morons   says they dont give Personal Loans to contractual employess       they grant only to bonded lab  ,END
Complaint,   What is TAT for closing CC  Today is  th day of Twitter follow up   th day of branch request dtd   Sep  TODAY   ,END
Complaint, why you proclaim that you have a     customer care suppo 
When you can t keep it  ,END
Complaint, in did transaction on IRCTC to book a ticket though net banking then cancelled ticket as per IRCTC amount is sent to bank,END
Complaint, No one fraud bank in all private sector one   
  TMD B gX,END
Complaint,what do you understand by priority it means one month    ,END
Complaint,  Need a prompt response from your team   as i am following up with this concern from  th Oct ,END
Complaint,   hvn t been able to onboard with kotak account couple of prblms  tweeted but no rspnse from   or  ,END
Complaint,  messg i get but no call   this is service of Kotak  my patience they wana appreciate  i say hw muc   ,END
Complaint, I thought that u r a credible FI but anyways  My PL app form no is      U ve rejected it becoz I am a contractual emee,END
Complaint, Nearly impossible to reach you guys on the new Toll Number  It says the number does not exist  now it gives a busy tone,END
Complaint,e mail complaint also sent on  th October still no reply,END
Complaint, how many days u need to resolve d issue  Ur customer care service very poor  They are Damn unprofessional  give rude reply,END
Complaint,    
 CRN no   have requested for hard copy of my internet banking password on  th Sept  E mail also sent but ,END
Complaint, 
 CRN no   have requested for hard copy of my internet banking password on  th Sept  E mail also sent but no response,END
Complaint,well it gonna be   days Still waiting for my cheque clearance  For God sake what kinda banking system is this  Frustrated,END
Complaint,please break the silence and reply to my query  I don t want to wait for unknown time  Need date of refund,END
Complaint,Wait    wait  Let me pen down something for u    ur policies  Just wait,END
Complaint, As per    s fucked up policy they offer loans only to bonded labours    slaves  not to contractual corporates or journalists ,END
Complaint,how u recruited your employees even they don t know spellings/copying they changed my name to meaning    QWYwk,END
Complaint, Since last half month you pulling your team and your team shouted on customer  cheater,END
Complaint,Shut the fuck Up team     U have pushed me to use such Lang  U come up with disgusting excuses that U d    U,END
Complaint,It is so disgusting   st   thn   then   rejects my application for PLs    Cr Crd despite all records Ok,END
Complaint,Lies Lies    Lies  Just now ur exes called me    confirmed that ur    will not stand by me coz am a cont    UZrctBA,END
Complaint,am fed up with banks like    ,END
Complaint,contractual employee with the  IndianExpress  So we came in a Tsunami or R we untouchables that loans cant be given to us     ,END
Complaint,EVRYDAY I CURSE THE MOMENT WHEN I ASSOCIATED WITH YR BANK,END
Complaint, trust you have recvd my emails    yr team s working on it  If u cnt do anythin  thn write it and send it in email,END
Complaint,U only understood social media msg  U guys mentioned charges got reverted but not yet reflected since  th sep   pathetic,END
Complaint,       Your team don t think update me  even i called your Bank representative he shouting on me ,END
Complaint,         Have got the answer  its around   days over and your turtle team still trying  ,END
Complaint,It still doesn t reflect in my   A/C,END
Complaint,Kotak takes   days to open account  Its upsetting that the rel n mgr said it will be expedited  tomorrow   its been   alrdy,END
Complaint,Is net banking system overburdened now because from past   minutes I am not able to log in Net banking account,END
Complaint,   pathetic srvc no action aftr login press  NoMoreKotak        CloseMySalaryAcc  TellProcess Close   miss,END
Complaint,pathetic srvc no action aftr login press  NoMoreKotak        CloseMySalaryAcc  TellProcess Close    qPTRr,END
Complaint,it s been   days till now no response,END
Complaint,tried to withdraw   from a   ATM ATM code wgpo  no money came out and ATM went out of service,END
Complaint, Yes the issue remains the same  despite changing the browser  Need your assistance here ,END
Complaint,Is the IMPS service available today  I am unable to use it ,END
Complaint, I am facing same problem with   at yagnik road branch rajkot gujarat   R ,END
Complaint,   
Worst service  Complain pending since  months  Irresponsible branch mngr   rajkot rushabh doshi ,END
Complaint, the money is reversed  But with no explanation for d debit     I believe  this is a big scam going on in ur Bank ,END
Complaint,pathetic service is the only word I can think offs   ,END
Complaint,you guys are silent again   recd an email that my service request closed successfully   WITHOUT ANY RESOLUTION  ,END
Complaint, i dnt undrstnd wat r u wrkin on  its ben   days now   Waste servce,END
Complaint, wat a horible service provided by kotak  would nvr sugest any  to bnk wid kotak 
 kotak  ,END
Complaint,    team any updates 
Wat a horible bnking xprnce 
Wrst servce ever 
Nt evn an acknwldgmnt in   dys 
Kotak sucks ,END
Complaint,twitter banking nt getting any responses   Frm  week nw,END
Complaint, My last   concecutive transactions of Rs    have nt done but balance debited from my account  check    recredit pls  ,END
Complaint, worse service given by Kotak Mahindra Bank   took credit card  charged me so badly   pathetic service of customer care ,END
Complaint, extremely disappointed with your customer service  If a privileged customer is treated this way  how are ordinary customer ,END
Complaint,  after reply personally   not replying only they are worried about public domain     ,END
Complaint, What the     ing bank    I never recommend ur bank to anyone   u guys r charging even for imps money transfer       Go to hell,END
Complaint,some staff are not polite if we ask anything regarding filling up form they scold u don t know even that thing ,END
Complaint,Is there any update      Its almost a month ,END
Complaint, I have taken Car Loan       through PMSP A/c  but in PMSP A/c it is       I have not got the benefit of PMSP ,END
Complaint,  How will I know that my card has been hacked when SMS service is not operational,END
Complaint,   No action on my Complaint, u people want SBI to be closed   ,END
Complaint,  SMS is not working in places  I am an a/c holder OF SBI  I am not getting SMS when I draw money from ATM,END
Complaint, If the hackers can get access to the database of   
Then on what grounds do   and   stand ,END
Complaint,harrasing for the past one year by not paying Leave encashment on my retirement  pray to solve,END
Complaint,Credit card payment transferred on  nd Oct  Not credited till date  No practical solution offered     ZsEOdF,END
Complaint, sbi is largest bank in India  how this is lost our confident record of cards ,END
Complaint, 
I have given many time my issue but   still I have not received any reference number at your end,END
Complaint,I wish RM cared   respond  Hoping people   know about this  Thank you for the info though ,END
Complaint,Experienced fraudulent transactions on my credit card for the first time  Had to get it blocked  Efficient suppo from ,END
Complaint,hi  Thanks but no calls yet or no correction in account yet ,END
Complaint, good to see you appreciating attention to details  however   hasnt resolved my issue even in   months ,END
Complaint, Respected Sir  I have an idea to achieve more and gain revenue as well as customer So for my suggestion please reve me  Thnx,END
Complaint,I applied for Personal loan   Make sure commitment from Your side is Being Completed    Frustration  poorService,END
Complaint, 
Home loan partial payment issue   kharadi   pune  loan centre is not responding  ,END
Complaint, 
Worst expiernce at Kharadi  pune  Home loan Centre  Partial payment debit not yet done    no,END
Complaint,  trying to reach your relationship officer  but he is not picking the phone  Regarding home loan disbursement  Please help ,END
Complaint, hey  was trying to apply for a personal loan  It wont allow me to get past this screen  What to do    Q,END
Complaint,      Applied for a credit card promised by the agent  received a different  downgraded  one  Such unp ,END
Complaint,   Applied for a credit card promised by the agent  received a different  downgraded  one  Such unprofessionalism ,END
Complaint, kindly check  have requested Credit card on ur site    rec call on this number in     pm that was fishy fr me Pl investigate,END
Complaint,requested for home loan documents at the branch  I can t understand why it should take   days for a simple request,END
Complaint,NP I visited the home loan branch for PMAY way they responded made me not to visit your bank anymore,END
Complaint, Dear ICICI Bank 
My Father is getting calls from one of ICICI employee who is misbehaving with him for past loan settlement,END
Complaint, any other wants home loan lead   fed up  ready to switch      ,END
Complaint,we harrased by icici bank due to car loan kindly help cont no ,END
Complaint,horrible service from your loan department  No followup from  your side  You took money but it s not reflected in my account,END
Complaint,My credit card is not being deliver since a month now can yo help me get this done as   messed it up big time,END
Complaint, 
I m holding SBI HDFC AXIS ICICI RBL credit cards but I can t get kotak credit card even though I m your customer ,END
Complaint, 
Dear kotak team
This is my  th rejection credit card appli ation number   sQ ,END
Complaint, 

Dear kotak team
This is my  rd rejection credit card application number  ,END
Complaint, 

Dear kotak team
This is my  nd rejection credit card application number   r S fW,END
Complaint, 
dear kodak bank team
My credit card application was rejected consecutively   times I don t know the reason 
 ,END
Complaint, bearing it for the third time  

Writing an email to service loans  com in the middle of night  Consider referring to it ,END
Complaint,unable to apply for a credit card on your website,END
Complaint,        Taking home loan from Kotak is mental torture I am not in audit but they are forcing me for CA attestation,END
Complaint,       Taking home loan from Kotak is mental torture  I am not in audit but they are forcing me for CA attestation,END
Complaint,you have confirmed on mail that charges cant b waived off to which I hav askd u to mark loan as NPA as I won t pay like fool,END
Complaint,   visits branch    calls at customer care    days of interaction with loan executive  Still waiting   patheticService,END
Complaint,  ur credit card team just fails   respond even after   days of continuous follow ups  Degraded service standards,END
Complaint,where is my credit card  more than a month now,END
Complaint,  I have applied for Personal loan     wk before    loan approved    but for last days I am getting tortured for DD  ,END
Complaint,   I am very sorry to inform you that I had a very bad experience with house loan   account no IHL ,END
Complaint,  I made a request for new credit card on my new address  which bank is not able to deliver  
Call me    will explain,END
Complaint, Its been   days    no response but a EMI is bounced without me taking loan Its long wait think i should go legally Poor KMB ,END
Complaint,My credit card is not working my debit card is not working the relationship manager is not picking up the phone,END
Complaint, It is saddening to know that      alike gives PL    Cr Card to ppl who might not in serious need  but rejects mine coz am a   ,END
Complaint,my dad is government employee and applied for loan from SBI  Bank is harrashing Him  Plz help Pathankot Punjab,END
Complaint,what about my waiting time for   months  How I could get image card now     Reply would be appreciated,END
Complaint,I need  know is it really required  mnths   service Name debit card Whereas I was eagerly waiting   image card  Pls reply,END
Complaint,had asked the branch to coordinate regarding  some Demat account charges  No has called yet  Can you assign anyone please,END
Complaint, Sir  how much time required for crediting NEFT amount from SBI to ICICI saving account  Three days  What RBI guidelines are ,END
Complaint,   Why is Mr  Ravi Narayanan is Not giving Call  as confirmed  Ref No ICICICARE=     
 TarikhPeTarikh  ICICI,END
Complaint,No call back received yet  No emails  No details provided  Kindly contact ASAP,END
Complaint, i have noticed fraudulent activity on my net banking and a huge amount is missing  please help ,END
Complaint,     and till now no result a/c is with civil lines Nagpur Maharsatra  branch
All details given to the bank,END
Complaint,     
My icici account has been cloned by some one and withdrawn  k from Delhi as per the icici bank 
Cont d ,END
Complaint,i am charged MAB charges on my account thrice without any info available on my account profile about MAB reqmt  Plz rvrs,END
Complaint,I have sent you the details in DM  Please look into this matter very urgently,END
Complaint,  Bank complain no is SR    Till now I haven t got any positive response from the ICICI Plz do the needful ASAP,END
Complaint,   How to cancel ICICI credit card  it was completely useless  when I needed it ,END
Complaint,  Till now nobody has contacted me about my complaint  May I know how much more time it will take,END
Complaint,the foreclosure letter rcvd from u says prepayment charges   wt r dis chrgs pls  Was told no prpymnt pnlty earlier Pls help,END
Complaint, Some     random transactions in Euro  USD  INR for amounts ranging from USD   to    Not sure from where  ,END
Complaint, I hv done a NEFT frm my a/c this mrng to a sbi a/c still that transaction has nt been done  may I know the reason ,END
Complaint,till now I not have received your statement of my cc card than don t blame me for delay payment also make sure it not effect,END
Complaint,Service Request SR    Fruad ATM cash withdrawal trans of Rs   I am in hyd    ATM trnsc in mumbai Pls help,END
Complaint, I need assistance as soon as possible  SR    SR      SR      Its been   days and no response,END
Complaint, I still have not received a single phone call  its been almost   days and the money has not been credit back ,END
Complaint, Int add payee page IFSC code search is showing wrong address  for same code other sources showing c   ,END
Complaint, haven t received a NEFT credit ale to a payee for a transfer I did in the morning  Help please,END
Complaint,SR  on      No card received till date  Plz issue any debit card on priority     I m nt able to trnfr,END
Complaint, 
Pl reve my money in my account  that is     lac  Unable to Never continue ,END
Complaint,customer care needs pin  No way I can talk to anyone without pin  My no    Please I need to use the card now,END
Complaint,  weeks since your agent collected docs    cheque  Account still not activated  No communication from branch  Pls  escalate,END
Complaint, So  tell me what kind of security ur providing to my account and why it takes   days  and how can I survive in abroad now ,END
Complaint,     my client wrongly paid excess IncomeTax through ICICI online  can we get reversal by  th Oct mrng,END
Complaint,wish to open savings account  ur customer care number doesnt hv precise extension that provides info on opening savings acc,END
Complaint, Credit card issues only dumping my daily activities  Let me know when will resolve,END
Complaint,Still not resolved my CC issues Its very horrible for ur service i explained abt my present status kindly reve as positive,END
Complaint,Could you please look into this issue which i raised   weeks back     Ticket   MaBX U XXUET   Credit Card   Charges,END
Complaint,still waiting,END
Complaint,complain no   SR  s still not resolved even after   days   how many days will u guys take,END
Complaint, I got a message that says I met your executive at     at      PM  now   when I didn t  Wtf is going on ,END
Complaint,Unauthorized transactions in my bank account on     Details messaged to you and antiphishing  com Please act,END
Complaint,SR   I have recording that Ashwini told it will get resolve in   hour  Still wiating for reply  nri  icicibank  bank,END
Complaint, Don t lie my number is working fine  getting calls from many people  try now ,END
Complaint,I ve been having difficulties getting a fraudulent transaction issue sorted after months of waiting  Can someone fix this,END
Complaint,complaint still unresolved,END
Complaint,  ATM installed   Pir Mitha Jammu gives false Alarms    Clients inside feel embarasd Plz Help No action on previous Submission,END
Complaint, ignoring the customer when he actually needs it is what is wrong  However  I would like to thank you for providing me  ,END
Complaint,unbale   acces iMobile n unable to speak to customer care executive even after repeated calls to call center  Whats next,END
Complaint,not able to transfer money via App  Error code  U   Customer care is not wiling to transfer call to app department,END
Complaint,hey i am still awaiting for my  k  no update from the branch  please take immediate action its high time now,END
Complaint,And how many more days for that ,END
Complaint,I hav been trying to call on   of your branches in Andheri  W Mumbai for forex availability  Unable to get thru any Urgent,END
Complaint,HELLO    How does one contact u   I need to block my lost debit card  Ur app is useless and ur toll free is till  pm,END
Complaint,   What is the progress on this  Unbelievable laxity,END
Complaint,  after   months   was sleeping plz share proof of SR request closure or out    kwL UK,END
Complaint,  awesome customer care  just been advised to ignore security sms    we send it to all ignore it please     veryfunny,END
Complaint, everything is shared with your team  that day your team documented everything  I don t want to repeat same thing again ,END
Complaint,  more bad experience with ICICI  Please look at the below screenshot for more information  ,END
Complaint,i chcked but there u didnt mentioned which cash deposit machine operate beyond banking hours  i need to know where its   ,END
Complaint,hi kotak team kindly resolve my issue don t try to say what is cause worst managament shame on u,END
Complaint,I understand but I don t want to pay an additional fee of converting a particular currency to another within my card,END
Complaint, Someone is misusing my email ID on a Kotak bank account  how can this be stopped,END
Complaint,Have tried connecting to the Call centre was on hold for   mimute but then also no reve   Is there a way u can help,END
Complaint,please implement penalty on banks like     who reject NACH mandates of NBFCs for random reasons,END
Complaint, Dear Nodal officer
Please wake up from your dreamy paradise and reply on service request number SR     ,END
Complaint,if ur Bnk have little shame then ur representative can call me now         ,END
Complaint,    th day of Twitter followup   th day of branch request dtd   Sep  Pls reply on reversal    original docs return,END
Complaint, Hey  I have a Jifi Account woth you guys but I am unable to redeem any vouchers out of the points  Plz let me know how to get ,END
Complaint, please be mindful of arranging the call on time  
I get paid on hourly basis which kotak isn t paying ,END
Complaint,my salary was   than how your employee open   maintain a/c he don t told me about that  plz help me  I need your help,END
Complaint,In your Net banking portal taxes paid yesterday hasn t been confirmed even after   hours No challans Stuck with my IT returns,END
Complaint,ITS over   days and no resolution/mail/call from kotak yet  What shd i do,END
Complaint,    th day of Twitter followup   th day of branch request dtd   Sep  Pls reply on reversal    original docs return,END
Complaint, crn no    repeated request to cancel india ma ecs mandate is to no avail  Kindly resolve the issue ,END
Complaint, 
I have spoken to one of the irresponsible customer care executive   minutes ago 
She didn t understand concern  Can someone,END
Complaint, 
But I was not informed about the charges at the time of opening savings account  I would like to know  frequency of charges,END
Complaint, 
Charges as annual fee I visited branch office ECIL Hyderabad  TELANGANA  I have not received any response Can some one addres,END
Complaint,I would like to change my bank  What is the procedure please let me know,END
Complaint,doesn t even pertain to Kotak Bank  Please read,END
Complaint, very strange  I am getting all the calls  don t know how you are unable to reach  Please call tomorrow at  am,END
Complaint,Interest charged even after opting for No Cost EMI for my purchase on   using my   CC Please look into it    waive it off,END
Complaint, 
I have submitted the evidence of WhatsApp chat  and the answer is same  Share the email Id and will send to you all details ,END
Complaint, Cheque Pick up Service very poor 
Please take immediate action ,END
Complaint, Hi  I want to unblock my credit card  tried calling but number is not working  Please help,END
Complaint,asking for maintaining  k as AMB  when it has been converted to savings account   years back  why waking up now,END
Complaint, 
I can t trust on ur services u d t care   cx requirements Wat is the process   shutdown my  account    return credit card ,END
Complaint, just opened family AC  One of my account has been charged for debit card fees  I believe it s free for  st year    Help me,END
Complaint, how much time does it take to open a saving account in your bank   
It s been a week and yet no response from branch ,END
Complaint,need statement   my Biz loan  been running from branch to customercare to loan guys   past week but no result  can some  help,END
Complaint,   Will anyone come forward with answer  Can you process reversal n closure today  if not today then by what date   ,END
Complaint,local fellow not using discretion if other banks can do why can t you please provide documents for settling claim,END
Complaint, Dear sir  if u have the answer to my query pls respond  I am being harassed by ur official on this pretext ,END
Complaint,The sad pa is even simple queries and requests take   days    Why not be a frontrunner and improve r    BpF CytY,END
Complaint,looting customers in the name of travel card  Hoping for someone to help out    hs,END
Complaint,its almost a week now and you guys have not taken any action yet <U  E D>his is frustrating  I need date by when I will get my money,END
Complaint,how many times you will say the same words that bear with us   please understand others problem also I need my money urgently,END
Complaint,how i trust u   similar stmt u have been making for the past    months  i just want to know the max time u wil tak it,END
Complaint,cant find a response on listed number of kalbadevi branch  waiting update on a transfer cheque  can u help,END
Complaint,have   current a/C but unable to use mobile banking for second  Err  invalid credentials  Please assist,END
Complaint, should I bank when is working fine or when I need 
 PoorestSuppo  PleaseCloseMyAccount  CantTakeThisShitAnymore,END
Complaint,the sms was shared with your team last week and duly acknowledged by them   what else u need    ,END
Complaint,I ve not got any msg regarding my ATM card pin change owing    ATMCard fraud  How can I get to know if my card is safe,END
Complaint,   Premature withdrawal of PPF modified by Finance Ministry not implemented by SBI Branches Plz circulate to br,END
Complaint, Most of the times onlinesbi loginn showing   Your session has expired  Please login again   Why is it so Pls solve the issue ,END
Complaint,  your telephone suppo is not able to provide correct info in creditcard interest  What is your email  Help,END
Complaint,Also you need to take pledge to solve bugs on internet banking on top priority rather than keep customers confused,END
Complaint,Visited your branch at Lakamanahalli Dharwad  Disappointed by ur hidden terms  Normal savings account  rs transaction,END
Complaint, request you to please arrange a call back regarding   SR    
Your exec ishita closed the complaint w/o informing,END
Complaint,your illiteracy about India    its ppl continues   Not sure how it makes sense   u when u air Hindi ads in Kannada FM channels,END
Complaint,iOS app has too many issues in login,END
Complaint, Why   YOUR DND    There s a national DND which you need to honor ,END
Complaint, jH 

    again received fraud call asking abt credentials      Any action plan ,END
Complaint,Just to let you know a bank account with no transaction facility is useless,END
Complaint, the vast section in Bengaluru understands Kannada 
I cudnt find kannada challan in ur bank
